movie_id,movie_name,year,genres
3868,Hamari Kahani Ke Rang,1959,Comedy
3869,Jab Raat Hai,1977,Comedy
3882,Dil Raat Se Mulakaat,1973,Comedy
3884,Jab Jung Se Mulakaat,1981,Comedy
3899,Dil Jung Ka Safar,1987,Comedy
3905,Tum Jung Ki Duniya,1938,Comedy
3911,Aashiq Pyaar Ka Intezaar,1985,Comedy
3921,Khiladi Pyaar Ki Kahani,1975,Comedy
3922,Prem Manzil Se Mulakaat,1998,Comedy
3924,Jab Dosti Hai,1945,Comedy
3925,Dil Sapna Ki Kahani,1958,Comedy
3929,Aashiq Zindagi Ka Raaz,2012,Comedy
3943,Tera Mission Ki Baatein,1940,Comedy
3948,Prem Mission Ki Duniya,1936,Comedy
152,Dil Raat Ke Rang,1991,Horror
177,Dil Manzil Ki Baatein,1936,Horror
188,Tera Kahani Ki Kahani,1952,Horror
220,Baazigar Zindagi Ka Raaz,1953,Horror
328,Baazigar Raat Se Mulakaat,1977,Horror
366,Shree Pyaar Ki Duniya,2004,Horror
397,Hamari Raat Ka Intezaar,1938,Horror
565,Prem Pyaar Hai,2000,Horror
606,Ek Kahani Ke Rang,2016,Horror
775,Hamari Jung Ki Baatein,1966,Horror
841,Khiladi Manzil Hai,1982,Horror
842,Prem Mission Hai,2025,Horror
879,Khiladi Andaz Ki Duniya,1932,Horror
1105,Chalte Zindagi Ka Safar,2007,Horror
1128,Chalte Raat Ka Intezaar,2023,Horror
1130,Raj Pyaar Se Mulakaat,1930,Horror
1168,Baazigar Rishta Ki Baatein,1952,Horror
1258,Tum Manzil Ka Safar,1932,Horror
1321,Raj Pyaar Ka Intezaar,1938,Horror
1322,Jab Sapna Hai,1954,Horror
1323,Jab Dosti Ka Raaz,2020,Horror
1324,Raj Dosti Se Mulakaat,2020,Horror
1325,Prem Manzil Hai,1935,Horror
1326,Jab Sapna Ka Raaz,1981,Horror
1327,Baazigar Zindagi Ki Baatein,2013,Horror
1328,Chalte Pyaar Hai,1992,Horror
1329,Jab Rishta Ke Rang,1977,Horror
1331,Hamari Rishta Ka Safar,2000,Horror
1333,Tera Kahani Ki Kahani,1936,Horror
1336,Chalte Mission Ka Intezaar,1998,Horror
1337,Prem Mission Ka Raaz,1930,Horror
1340,Shree Andaz Ke Rang,1988,Horror
1341,Tera Pyaar Ki Duniya,1973,Horror
1342,Prem Mission Hai,2013,Horror
1345,Jab Raat Ka Raaz,1955,Horror
1346,Khiladi Raja Ka Safar,1944,Horror
1347,Tum Pyaar Se Mulakaat,1934,Horror
1348,Jab Pyaar Hai,1948,Horror
1349,Raj Zindagi Ki Kahani,1992,Horror
1350,Baazigar Andaz Ka Intezaar,1999,Horror
1623,Tum Manzil Ki Duniya,2023,Horror
1655,Chalte Zindagi Ki Duniya,1985,Horror
1756,Shree Mission Ki Baatein,2016,Horror
1771,Jab Raat Hai,1935,Horror
1969,Hamari Jung Ke Rang,2006,Horror
1970,Dil Sapna Ki Duniya,1935,Horror
1971,Hamari Andaz Ki Kahani,2021,Horror
1972,Aashiq Pyaar Se Mulakaat,2001,Horror
1973,Aashiq Sapna Ka Safar,1989,Horror
1974,Aashiq Mission Se Mulakaat,1966,Horror
1975,Chalte Zindagi Ki Kahani,1987,Horror
1976,Hamari Manzil Ka Raaz,1931,Horror
1977,Hamari Mission Se Mulakaat,1939,Horror
1978,Shree Mission Ki Kahani,2004,Horror
1979,Aashiq Zindagi Ki Baatein,1991,Horror
1980,Tum Jung Hai,2024,Horror
1981,Aashiq Manzil Ka Intezaar,1984,Horror
1982,Prem Pyaar Ka Intezaar,1954,Horror
1983,Ek Sapna Se Mulakaat,1942,Horror
1984,Khiladi Sapna Ki Kahani,1991,Horror
1985,Hamari Sapna Ka Raaz,1936,Horror
1986,Tum Jung Ka Safar,1984,Horror
1987,Ek Jung Ki Kahani,2009,Horror
1988,Chalte Kahani Ka Safar,1945,Horror
1989,Chalte Raat Ke Rang,2011,Horror
1990,Dil Jung Ki Baatein,2013,Horror
1991,Ek Rishta Ke Rang,1955,Horror
1992,Ek Mission Ka Raaz,1983,Horror
1993,Baazigar Kahani Ka Raaz,1966,Horror
1997,Dil Sapna Ki Baatein,1978,Horror
1998,Ek Dosti Ka Safar,2014,Horror
1999,Tum Kahani Ka Intezaar,1940,Horror
2119,Tera Jung Ka Raaz,1961,Horror
2327,Raj Zindagi Ka Safar,1999,Horror
2328,Baazigar Sapna Ka Intezaar,2000,Horror
2451,Dil Jung Se Mulakaat,1960,Horror
2452,Tum Rishta Se Mulakaat,1992,Horror
2459,Tum Pyaar Ki Duniya,2002,Horror
2460,Chalte Kahani Ka Safar,1941,Horror
2461,Aashiq Raja Ke Rang,1935,Horror
2462,Aashiq Raja Ki Baatein,1984,Horror
2464,Hamari Andaz Ka Raaz,1998,Horror
2465,Ek Rishta Ki Duniya,1955,Horror
2513,Baazigar Sapna Ki Duniya,1967,Horror
2514,Tera Dosti Ka Safar,1992,Horror
2515,Tera Andaz Ki Kahani,1996,Horror
2516,Prem Raat Ki Baatein,1994,Horror
2517,Shree Jung Ki Duniya,2003,Horror
2519,Hamari Pyaar Ka Raaz,1996,Horror
2548,Aashiq Andaz Ki Duniya,1976,Horror
2634,Khiladi Kahani Ki Duniya,2014,Horror
2635,Prem Rishta Ka Safar,1955,Horror
2636,Jab Mission Se Mulakaat,1940,Horror
2637,Prem Jung Ki Kahani,1950,Horror
2638,Dil Mission Ki Duniya,1959,Horror
2644,Khiladi Sapna Ka Raaz,1940,Horror
2645,Shree Sapna Ka Raaz,1991,Horror
2646,Baazigar Andaz Ka Intezaar,2025,Horror
2647,Khiladi Rishta Ke Rang,1988,Horror
2648,Aashiq Dosti Ki Kahani,1933,Horror
2649,Hamari Raja Ki Kahani,2018,Horror
2650,Hamari Rishta Ke Rang,2012,Horror
2651,Aashiq Manzil Ke Rang,2010,Horror
2652,Shree Raja Ke Rang,1936,Horror
2653,Tera Sapna Ki Baatein,1975,Horror
2654,Shree Raja Ka Intezaar,1993,Horror
2655,Baazigar Dosti Hai,1942,Horror
2710,Raj Manzil Hai,1986,Horror
2740,Tera Zindagi Se Mulakaat,1996,Horror
2754,Tera Mission Ki Baatein,1970,Horror
2781,Aashiq Sapna Hai,1945,Horror
2782,Dil Manzil Ka Raaz,1982,Horror
2783,Aashiq Mission Ki Duniya,1960,Horror
2784,Baazigar Rishta Ki Kahani,1971,Horror
2785,Jab Pyaar Ki Duniya,1958,Horror
2787,Aashiq Mission Ka Intezaar,2013,Horror
2789,Tum Rishta Ka Intezaar,1985,Horror
2790,Aashiq Rishta Ka Safar,1966,Horror
2814,Chalte Kahani Ki Duniya,1966,Horror
2853,Aashiq Sapna Se Mulakaat,1967,Horror
2854,Baazigar Andaz Ki Duniya,1931,Horror
2855,Raj Pyaar Se Mulakaat,1933,Horror
2868,Khiladi Manzil Ka Raaz,1962,Horror
2878,Dil Rishta Se Mulakaat,2003,Horror
2995,Khiladi Zindagi Ka Intezaar,1970,Horror
3016,Tum Andaz Hai,1998,Horror
3017,Aashiq Mission Ka Intezaar,2008,Horror
3018,Baazigar Jung Se Mulakaat,2001,Horror
3021,Hamari Sapna Ki Baatein,1985,Horror
3026,Prem Jung Ki Duniya,1945,Horror
3027,Prem Zindagi Ki Kahani,1945,Horror
3085,Prem Zindagi Hai,2008,Horror
3119,Baazigar Rishta Ki Baatein,2000,Horror
3205,Baazigar Rishta Ke Rang,2020,Horror
3216,Jab Pyaar Ki Baatein,1955,Horror
3280,Ek Jung Ke Rang,1964,Horror
3294,Raj Pyaar Ki Kahani,1966,Horror
3344,Ek Manzil Ka Intezaar,2023,Horror
3346,Prem Pyaar Ki Baatein,2009,Horror
3351,Ek Andaz Ka Raaz,1974,Horror
3472,Dil Andaz Ki Duniya,2004,Horror
3485,Aashiq Jung Ka Safar,1959,Horror
3490,Shree Rishta Ki Duniya,1965,Horror
3493,Tera Raat Ka Raaz,1990,Horror
3499,Tum Raat Hai,2004,Horror
3550,Shree Manzil Ka Safar,2004,Horror
3587,Prem Dosti Ka Raaz,1961,Horror
3589,Jab Jung Hai,1966,Horror
3630,Jab Andaz Ka Safar,1970,Horror
3650,Chalte Kahani Ka Intezaar,1949,Horror
3651,Khiladi Jung Ka Safar,1960,Horror
3652,Chalte Raat Ka Intezaar,2018,Horror
3709,Chalte Manzil Ka Raaz,1984,Horror
3732,Dil Jung Ka Safar,1930,Horror
3757,Raj Jung Ka Intezaar,2016,Horror
3762,Aashiq Rishta Ki Kahani,1988,Horror
3772,Aashiq Jung Ki Kahani,2023,Horror
3832,Raj Zindagi Ka Safar,1976,Horror
3837,Hamari Mission Hai,2004,Horror
3838,Raj Rishta Ka Safar,1993,Horror
3839,Tum Mission Hai,1932,Horror
3840,Ek Raja Ki Kahani,2014,Horror
3842,Hamari Sapna Ka Raaz,2017,Horror
3843,Chalte Pyaar Se Mulakaat,1976,Horror
3847,Khiladi Raja Se Mulakaat,2016,Horror
3875,Aashiq Mission Ki Duniya,2016,Horror
3892,Jab Andaz Ki Baatein,2007,Horror
3908,Chalte Raat Hai,1971,Horror
3917,Aashiq Kahani Ka Safar,1981,Horror
3918,Aashiq Zindagi Se Mulakaat,1978,Horror
3919,Aashiq Zindagi Ki Kahani,1976,Horror
3930,Dil Andaz Ka Raaz,1984,Horror
3935,Prem Zindagi Ka Raaz,2009,Horror
3938,Raj Raat Ki Duniya,1972,Horror
3939,Jab Kahani Hai,1972,Horror
3940,Hamari Andaz Ka Intezaar,2015,Horror
3941,Baazigar Raat Ke Rang,1982,Horror
3942,Jab Manzil Ka Safar,2016,Horror
111,Baazigar Rishta Ke Rang,1987,Drama|Thriller
199,Raj Mission Ki Kahani,1959,Drama|Musical
260,Khiladi Mission Hai,2021,Action|Adventure|Fantasy|Sci-Fi
390,Shree Mission Ka Safar,1989,Action|Comedy|Drama
541,Jab Kahani Ki Kahani,1970,Film-Noir|Sci-Fi
586,Raj Raja Ki Duniya,1965,Children's|Comedy
587,Aashiq Raat Ka Safar,1930,Comedy|Romance|Thriller
589,Ek Andaz Ki Kahani,1975,Action|Sci-Fi|Thriller
590,Jab Raat Hai,1975,Adventure|Drama|Western
592,Tera Raat Ka Intezaar,1970,Action|Adventure|Crime|Drama
593,Ek Sapna Ka Raaz,1965,Drama|Thriller
594,Aashiq Jung Se Mulakaat,1991,Animation|Children's|Musical
595,Jab Andaz Ki Duniya,1940,Animation|Children's|Musical
596,Tera Andaz Ki Baatein,2000,Animation|Children's
597,Dil Manzil Hai,1940,Comedy|Romance
599,Chalte Sapna Ka Safar,1942,Western
610,Khiladi Sapna Ke Rang,1932,Action|Adventure|Animation|Horror|Sci-Fi
616,Jab Sapna Ki Kahani,1963,Animation|Children's
659,Tum Zindagi Ke Rang,1974,Crime|Thriller
674,Aashiq Mission Ka Raaz,2012,Adventure|Sci-Fi
680,Tera Raat Hai,1975,Sci-Fi
681,Jab Raja Ka Safar,1946,Crime
709,Jab Pyaar Ki Baatein,1947,Animation|Children's
716,Ek Dosti Ki Baatein,2001,Crime
746,Aashiq Dosti Ka Raaz,1953,Film-Noir
750,Shree Zindagi Hai,1944,Sci-Fi|War
755,Dil Andaz Ka Intezaar,1996,Children's|Drama
771,Khiladi Pyaar Ki Duniya,2000,Comedy|Drama
792,Tum Raat Ka Raaz,1954,Fantasy
858,Tum Manzil Ka Safar,1973,Action|Crime|Drama
890,Shree Raja Ki Kahani,1937,Thriller
894,Shree Kahani Ka Raaz,2001,Romance
897,Chalte Andaz Ki Baatein,1950,Adventure|War
898,Chalte Dosti Ki Baatein,1952,Comedy|Romance
899,Tera Manzil Ki Baatein,2017,Musical|Romance
900,Tera Manzil Ki Kahani,2025,Musical|Romance
901,Hamari Andaz Ka Raaz,1995,Comedy|Musical
902,Tum Raja Hai,2025,Drama|Romance
903,Prem Zindagi Hai,2010,Mystery|Thriller
904,Tum Kahani Ka Safar,1949,Mystery|Thriller
906,Tum Andaz Hai,1973,Mystery|Thriller
907,Prem Pyaar Ki Duniya,2025,Comedy|Musical|Romance
908,Chalte Zindagi Ki Duniya,1961,Drama|Thriller
909,Tum Raat Se Mulakaat,1950,Comedy|Drama
910,Khiladi Raat Se Mulakaat,2015,Comedy|Crime
911,Shree Zindagi Se Mulakaat,2019,Comedy|Mystery|Romance|Thriller
912,Tum Pyaar Hai,2013,Drama|Romance|War
913,Jab Zindagi Ka Intezaar,1936,Film-Noir|Mystery
914,Khiladi Zindagi Ki Baatein,2024,Musical|Romance
915,Hamari Manzil Hai,1964,Comedy|Romance
916,Aashiq Jung Se Mulakaat,1946,Comedy|Romance
917,Chalte Zindagi Ka Safar,2017,Children's|Drama
918,Khiladi Manzil Ki Duniya,1967,Musical
919,Raj Andaz Ka Intezaar,1962,Adventure|Children's|Drama|Musical
920,Chalte Jung Ki Baatein,2015,Drama|Romance|War
922,Raj Pyaar Ki Kahani,1976,Film-Noir
924,Hamari Andaz Ki Baatein,1930,Drama|Mystery|Sci-Fi|Thriller
925,Prem Zindagi Ke Rang,2005,Adventure|Romance
928,Raj Rishta Se Mulakaat,1954,Romance|Thriller
929,Hamari Zindagi Ki Baatein,1971,Thriller
930,Hamari Sapna Ki Baatein,1955,Film-Noir|Romance|Thriller
931,Tera Raja Ka Safar,1971,Mystery|Romance|Thriller
932,Aashiq Mission Hai,2018,Romance
933,Ek Rishta Ka Raaz,1997,Comedy|Romance|Thriller
935,Tum Zindagi Ke Rang,1946,Comedy|Musical
936,Khiladi Jung Ki Duniya,1960,Comedy|Romance
937,Tum Raat Ka Intezaar,2024,Comedy|Romance
938,Raj Zindagi Ka Intezaar,1961,Musical
939,Hamari Raat Ka Safar,1944,Comedy|Drama
940,Tum Sapna Ki Baatein,1990,Action|Adventure
941,Prem Andaz Ka Safar,1983,Adventure
942,Chalte Zindagi Se Mulakaat,2003,Crime|Film-Noir|Mystery
943,Baazigar Raja Ka Raaz,1944,Drama|Romance
945,Dil Raat Ki Baatein,2019,Comedy|Musical|Romance
946,Ek Sapna Ka Raaz,1957,Comedy|Drama|War
950,Raj Raat Ka Intezaar,1987,Mystery
952,Hamari Manzil Ke Rang,1941,Adventure|Comedy
956,Dil Andaz Ki Duniya,1998,Drama|Romance
958,Jab Andaz Se Mulakaat,1937,Comedy|Mystery
960,Aashiq Andaz Ke Rang,1935,Crime|Drama
962,Jab Pyaar Ki Duniya,2004,Crime|Drama
963,Jab Dosti Ke Rang,1973,Musical
964,Baazigar Rishta Ki Kahani,1944,Western
965,Hamari Mission Ki Kahani,2022,Thriller
967,Ek Raat Ki Kahani,1953,Western
968,Shree Kahani Ki Kahani,2025,Horror|Sci-Fi
969,Raj Manzil Hai,2016,Action|Adventure|Romance|War
970,Dil Rishta Ki Duniya,2004,Comedy|Drama
974,Chalte Raja Ki Kahani,1998,Drama|Romance
975,Chalte Manzil Ki Duniya,1994,Comedy|Musical
976,Ek Mission Ki Baatein,1933,Romance|War
977,Raj Pyaar Ki Duniya,2024,Mystery
980,Chalte Jung Ke Rang,2024,Action
1007,Baazigar Zindagi Ka Raaz,1937,Children's|Comedy|Western
1008,Aashiq Kahani Hai,2020,Western
1009,Tera Sapna Se Mulakaat,1953,Adventure|Children's|Fantasy
1010,Chalte Dosti Ka Raaz,1973,Children's|Comedy
1011,Baazigar Jung Ka Raaz,1995,Adventure|Children's|Comedy
1012,Tum Zindagi Se Mulakaat,2001,Children's|Drama
1013,Prem Raat Ke Rang,2004,Children's|Drama
1014,Ek Pyaar Se Mulakaat,1937,Children's|Comedy|Drama
1016,Hamari Jung Ka Safar,2017,Children's|Comedy
1017,Khiladi Raat Ka Safar,1953,Adventure|Children's
1018,Tera Mission Se Mulakaat,2016,Children's|Comedy|Mystery
1019,Khiladi Pyaar Ka Raaz,2017,Adventure|Children's|Fantasy|Sci-Fi
1022,Raj Sapna Ke Rang,1936,Animation|Children's|Musical
1023,Khiladi Rishta Ki Baatein,2008,Animation|Children's
1024,Tera Sapna Hai,1967,Animation|Children's|Musical
1025,Aashiq Jung Ki Baatein,1962,Animation|Children's
1026,Tera Kahani Ka Intezaar,1957,Children's|Drama
1028,Tum Dosti Ke Rang,1985,Children's|Comedy|Musical
1029,Tera Zindagi Ke Rang,1995,Animation|Children's|Musical
1030,Dil Pyaar Ka Raaz,1983,Adventure|Animation|Children's|Musical
1031,Chalte Sapna Ki Kahani,1967,Adventure|Children's|Musical
1032,Hamari Raja Ki Kahani,1963,Animation|Children's|Musical
1033,Chalte Raja Ki Baatein,2000,Animation|Children's
1035,Ek Sapna Ka Intezaar,1932,Musical
1036,Jab Kahani Ke Rang,1981,Action|Thriller
1065,Khiladi Dosti Ka Safar,1995,Mystery
1066,Raj Andaz Ki Baatein,2015,Comedy|Musical|Romance
1067,Prem Raat Hai,1971,Comedy|Musical|Romance
1068,Aashiq Raat Ki Kahani,2009,Crime|Film-Noir
1069,Shree Rishta Ka Raaz,1978,Film-Noir|Thriller
1070,Shree Rishta Ki Duniya,2022,Adventure
1073,Hamari Manzil Hai,2018,Adventure|Children's|Comedy|Fantasy
1076,Prem Rishta Ka Safar,1948,Thriller
1077,Tera Raja Ka Intezaar,2007,Comedy|Sci-Fi
1078,Tum Andaz Ki Duniya,1974,Comedy|War
1081,Khiladi Raat Ki Kahani,2018,Comedy|Musical
1083,Tum Sapna Se Mulakaat,2014,Comedy|Musical
1084,Dil Zindagi Ki Kahani,1953,Crime|Drama
1085,Hamari Dosti Ki Kahani,1971,Adventure|Drama
1086,Hamari Kahani Se Mulakaat,1981,Mystery|Thriller
1088,Ek Raat Ki Duniya,1985,Musical|Romance
1090,Khiladi Zindagi Ke Rang,1946,Drama|War
1093,Tum Manzil Ki Baatein,1941,Drama|Musical
1097,Shree Jung Ka Safar,1973,Children's|Drama|Fantasy|Sci-Fi
1100,Khiladi Jung Ka Intezaar,2023,Action|Romance
1101,Shree Raat Ka Intezaar,1961,Action|Romance
1126,Tum Sapna Hai,1983,Comedy|Fantasy
1127,Baazigar Jung Hai,1945,Action|Adventure|Sci-Fi|Thriller
1129,Tera Jung Hai,2023,Action|Adventure|Sci-Fi|Thriller
1152,Tum Mission Ki Baatein,2024,Crime|Film-Noir|Thriller
1153,Shree Raat Ki Duniya,1946,Film-Noir
1154,Dil Kahani Ke Rang,1986,Film-Noir
1159,Hamari Rishta Ki Duniya,1943,Romance
1169,Prem Kahani Ka Raaz,1949,Documentary
1172,Chalte Mission Ki Kahani,1938,Comedy|Drama|Romance
1175,Tum Mission Ka Safar,2024,Comedy|Sci-Fi
1178,Hamari Manzil Ka Intezaar,1939,Drama|War
1179,Shree Jung Hai,1980,Crime|Drama|Film-Noir
1184,Prem Zindagi Ki Duniya,1951,Comedy|War
1189,Shree Kahani Ka Raaz,1999,Documentary
1191,Prem Dosti Ka Safar,1975,Documentary
1192,Hamari Raat Ka Safar,1961,Documentary
1196,Raj Zindagi Ki Kahani,2012,Action|Adventure|Drama|Sci-Fi|War
1197,Jab Raja Ki Baatein,1968,Action|Adventure|Comedy|Romance
1198,Ek Raat Ka Intezaar,2002,Action|Adventure
1199,Raj Rishta Ke Rang,1996,Sci-Fi
1200,Chalte Sapna Ki Duniya,1951,Action|Sci-Fi|Thriller|War
1201,Baazigar Pyaar Se Mulakaat,1972,Action|Western
1204,Aashiq Jung Ka Intezaar,1932,Adventure|War
1205,Khiladi Zindagi Ka Safar,1973,Action|Animation|Children's|Sci-Fi|Thriller|War
1206,Hamari Pyaar Hai,1985,Sci-Fi
1208,Dil Jung Ke Rang,1964,Drama|War
1209,Raj Manzil Se Mulakaat,1971,Western
1210,Aashiq Manzil Ki Baatein,1973,Action|Adventure|Romance|Sci-Fi|War
1211,Aashiq Raat Ki Kahani,1969,Comedy|Drama|Romance
1212,Aashiq Sapna Ka Safar,1941,Mystery|Thriller
1213,Tum Manzil Ka Raaz,1935,Crime|Drama
1214,Shree Sapna Ki Duniya,1946,Action|Horror|Sci-Fi|Thriller
1216,Chalte Rishta Ka Raaz,1944,Adventure|Romance
1217,Ek Raja Hai,1953,Drama|War
1218,Ek Mission Ki Kahani,2006,Action|Thriller
1219,Dil Pyaar Ki Kahani,1979,Horror|Thriller
1220,Tum Kahani Ka Raaz,1985,Action|Comedy|Musical
1221,Dil Jung Ka Raaz,2013,Action|Crime|Drama
1222,Prem Zindagi Ka Raaz,1946,Action|Drama|War
1224,Tera Dosti Ki Duniya,1987,Drama|War
1226,Dil Zindagi Ki Baatein,1941,Comedy|Romance
1227,Shree Raat Se Mulakaat,2008,Crime|Drama|Thriller
1230,Chalte Dosti Ke Rang,2020,Comedy|Romance
1232,Khiladi Rishta Hai,1949,Mystery|Sci-Fi
1233,Khiladi Sapna Ki Duniya,1963,Action|Drama|War
1234,Raj Andaz Ki Kahani,2001,Comedy|Crime
1236,Baazigar Kahani Ka Raaz,1970,Comedy|Drama
1240,Khiladi Zindagi Ka Safar,1991,Action|Sci-Fi|Thriller
1242,Raj Jung Ka Intezaar,1940,Action|Drama|War
1243,Raj Pyaar Ki Duniya,2016,Comedy|Drama
1244,Raj Rishta Ki Baatein,1994,Comedy|Drama|Romance
1247,Tera Zindagi Ki Kahani,1962,Drama|Romance
1248,Shree Raat Se Mulakaat,1985,Crime|Film-Noir|Thriller
1249,Khiladi Raja Hai,1960,Thriller
1250,Raj Andaz Ki Baatein,2010,Drama|War
1252,Tum Andaz Ke Rang,2018,Film-Noir|Mystery|Thriller
1253,Aashiq Zindagi Ki Kahani,1957,Drama|Sci-Fi
1254,Shree Manzil Ke Rang,1945,Adventure
1255,Shree Zindagi Ke Rang,1985,Comedy|Horror
1256,Aashiq Dosti Ki Baatein,1987,Comedy|War
1259,Ek Raat Ki Kahani,1974,Adventure|Comedy|Drama
1260,Tum Raat Ka Raaz,1956,Crime|Film-Noir|Thriller
1261,Ek Pyaar Hai,2023,Action|Adventure|Comedy|Horror
1262,Tera Kahani Ki Kahani,1994,Adventure|War
1263,Aashiq Kahani Ka Intezaar,2015,Drama|War
1264,Prem Raja Ka Safar,1949,Action|Drama|Mystery|Romance|Thriller
1267,Khiladi Rishta Hai,1935,Film-Noir|Thriller
1269,Ek Mission Ki Baatein,2021,Comedy|Mystery|Thriller
1270,Khiladi Sapna Ki Kahani,1984,Comedy|Sci-Fi
1272,Tera Rishta Ki Kahani,2020,Drama|War
1273,Ek Raat Ka Safar,1979,Comedy|Drama
1274,Shree Zindagi Ki Baatein,2004,Adventure|Animation|Sci-Fi|Thriller
1275,Jab Andaz Ka Safar,1954,Action|Adventure
1276,Raj Zindagi Ka Safar,1973,Comedy|Drama
1277,Khiladi Jung Ka Raaz,1999,Action|Drama|Romance
1278,Ek Raja Ka Intezaar,1945,Comedy|Horror
1279,Jab Andaz Ki Duniya,1933,Comedy|Drama
1282,Aashiq Mission Hai,2005,Animation|Children's|Musical
1283,Prem Pyaar Ki Baatein,1932,Western
1284,Prem Zindagi Ka Intezaar,1989,Film-Noir|Mystery
1286,Tum Jung Ka Intezaar,1999,Drama|Romance
1287,Aashiq Jung Ki Baatein,2016,Action|Adventure|Drama
1288,Raj Zindagi Hai,1977,Comedy|Drama|Musical
1289,Baazigar Kahani Hai,2002,Documentary|War
1290,Chalte Dosti Ke Rang,2004,Drama|Romance
1291,Ek Dosti Ka Safar,1959,Action|Adventure
1294,Khiladi Kahani Ka Safar,1965,Comedy|War
1296,Tum Raat Ka Safar,2002,Drama|Romance
1298,Tera Manzil Hai,1982,Drama|Musical|War
1299,Tum Sapna Ka Safar,1991,Drama|War
1301,Raj Pyaar Ka Safar,2014,Sci-Fi
1303,Chalte Jung Ki Kahani,2013,Adventure
1304,Ek Raat Hai,2022,Action|Comedy|Western
1306,Tera Rishta Ka Raaz,1972,Drama|Sci-Fi
1307,Hamari Pyaar Ka Raaz,1981,Comedy|Romance
1330,Khiladi Jung Ka Intezaar,2017,Comedy|Horror
1332,Chalte Raat Ka Intezaar,1933,Horror|Thriller
1334,Chalte Manzil Ki Duniya,1941,Horror|Sci-Fi
1335,Dil Raja Ka Safar,1986,Action|Horror
1343,Raj Kahani Ke Rang,1943,Thriller
1344,Aashiq Andaz Ke Rang,1970,Film-Noir|Thriller
1370,Khiladi Zindagi Se Mulakaat,1967,Action|Thriller
1371,Ek Andaz Ki Kahani,1963,Action|Adventure|Sci-Fi
1372,Dil Sapna Ka Raaz,1939,Action|Adventure|Sci-Fi
1373,Shree Rishta Ki Duniya,1933,Action|Adventure|Sci-Fi
1374,Aashiq Pyaar Ki Kahani,2007,Action|Adventure|Sci-Fi
1375,Tera Mission Ka Intezaar,1959,Action|Adventure|Sci-Fi
1376,Tum Raja Hai,2015,Action|Adventure|Sci-Fi
1378,Raj Raja Ka Intezaar,1995,Action|Comedy|Western
1379,Shree Mission Ke Rang,2008,Action|Comedy|Western
1380,Baazigar Rishta Ke Rang,1979,Comedy|Musical|Romance
1381,Hamari Mission Ki Duniya,2007,Comedy|Musical|Romance
1382,Raj Kahani Ke Rang,1954,Action|Drama
1386,Tum Dosti Ki Duniya,1966,Western
1387,Aashiq Mission Hai,1952,Action|Horror
1388,Khiladi Rishta Ki Kahani,1950,Action|Horror
1389,Chalte Mission Se Mulakaat,2013,Action|Horror
1395,Hamari Zindagi Ka Safar,2011,Comedy|Drama
1587,Aashiq Raja Ke Rang,1934,Action|Adventure
1610,Jab Kahani Ki Kahani,1953,Action|Thriller
1674,Baazigar Zindagi Ka Intezaar,2008,Drama|Romance|Thriller
1785,Jab Andaz Ka Safar,1950,Action|Crime
1913,Hamari Kahani Ki Kahani,1995,Drama|Mystery
1924,Baazigar Jung Hai,2024,Horror|Sci-Fi
1925,Baazigar Kahani Hai,2011,Drama|Romance|War
1926,Tum Zindagi Ka Safar,1984,Musical
1927,Tera Manzil Ki Baatein,1947,War
1928,Hamari Jung Hai,1969,Western
1931,Baazigar Jung Ki Duniya,2003,Adventure
1932,Khiladi Zindagi Ka Raaz,1991,Musical
1936,Aashiq Pyaar Hai,2010,Drama|War
1939,Baazigar Mission Hai,1988,Drama|War
1944,Prem Jung Ki Kahani,1973,Drama|Romance|War
1945,Ek Pyaar Ke Rang,1949,Crime|Drama
1946,Aashiq Andaz Ki Duniya,1991,Drama|Romance
1947,Prem Sapna Ka Safar,2010,Musical|Romance
1950,Aashiq Manzil Se Mulakaat,2010,Drama|Mystery
1951,Khiladi Andaz Hai,1981,Musical
1953,Khiladi Andaz Ka Intezaar,1987,Action|Crime|Drama|Thriller
1954,Shree Raat Hai,1979,Action|Drama
1958,Raj Dosti Hai,2005,Comedy|Drama
1959,Baazigar Rishta Ke Rang,2023,Drama|Romance
1960,Dil Manzil Ka Raaz,1974,Drama|War
1964,Prem Raat Ka Raaz,1985,Drama|Mystery
1965,Jab Dosti Hai,1998,Comedy|Sci-Fi
1967,Ek Zindagi Ka Raaz,2003,Adventure|Children's|Fantasy
1968,Dil Pyaar Se Mulakaat,1938,Comedy|Drama
1994,Raj Zindagi Ki Baatein,2015,Horror|Thriller
1995,Hamari Andaz Ki Kahani,1955,Horror|Thriller
1996,Baazigar Pyaar Ki Baatein,1934,Horror|Thriller
2000,Chalte Jung Se Mulakaat,1931,Action|Comedy|Crime|Drama
2001,Jab Dosti Ka Safar,2021,Action|Comedy|Crime|Drama
2003,Chalte Pyaar Ki Duniya,1998,Comedy|Horror
2004,Prem Sapna Hai,1996,Comedy|Horror
2005,Jab Zindagi Ka Safar,2005,Adventure|Children's|Fantasy
2009,Hamari Pyaar Ka Intezaar,1992,Sci-Fi|Thriller
2010,Chalte Sapna Ka Intezaar,1947,Sci-Fi
2011,Prem Raja Ki Baatein,1989,Comedy|Sci-Fi
2012,Jab Mission Ki Baatein,1955,Comedy|Sci-Fi|Western
2013,Tum Manzil Ki Baatein,1946,Action|Adventure
2014,Tera Kahani Ki Baatein,1982,Children's|Comedy
2015,Jab Andaz Se Mulakaat,1949,Children's|Comedy|Fantasy
2016,Chalte Pyaar Se Mulakaat,1985,Children's|Comedy|Western
2017,Hamari Raat Ka Intezaar,1983,Children's|Fantasy|Musical
2018,Chalte Mission Ki Baatein,1939,Animation|Children's
2019,Raj Kahani Ka Intezaar,1950,Action|Drama
2020,Hamari Dosti Ki Kahani,2008,Drama|Romance
2021,Dil Raja Hai,1962,Fantasy|Sci-Fi
2023,Jab Pyaar Ka Raaz,2019,Action|Crime|Drama
2024,Chalte Raja Ki Kahani,1966,Drama|Mystery
2031,Prem Rishta Ka Raaz,1992,Children's|Comedy
2032,Shree Andaz Se Mulakaat,1993,Children's|Comedy
2033,Raj Sapna Ka Intezaar,2011,Animation|Children's
2034,Tum Mission Ka Intezaar,1947,Sci-Fi
2035,Shree Pyaar Ke Rang,1976,Children's|Comedy
2037,Aashiq Manzil Ki Duniya,1974,Adventure|Children's|Comedy
2038,Khiladi Raat Ke Rang,1971,Children's|Comedy|Sci-Fi
2039,Aashiq Zindagi Ki Duniya,2019,Adventure|Children's
2040,Chalte Raat Ki Baatein,1990,Children's|Comedy
2041,Khiladi Raja Se Mulakaat,1984,Action|Adventure|Children's|Comedy
2043,Raj Zindagi Se Mulakaat,1992,Adventure|Children's|Fantasy
2046,Prem Jung Ka Safar,2016,Adventure|Children's|Sci-Fi
2047,Jab Manzil Hai,2005,Children's
2048,Khiladi Rishta Ki Kahani,1968,Animation|Children's
2049,Chalte Zindagi Ki Kahani,1934,Comedy|Musical
2050,Tum Dosti Ka Raaz,1976,Adventure|Children's|Comedy
2051,Tum Andaz Ki Baatein,2009,Adventure|Children's|Comedy
2054,Hamari Raat Ka Intezaar,1934,Adventure|Children's|Comedy|Fantasy|Sci-Fi
2055,Aashiq Sapna Ke Rang,1949,Comedy|Western
2056,Hamari Mission Ki Duniya,1940,Adventure|Children's
2057,Jab Manzil Ki Baatein,1978,Adventure|Children's
2064,Raj Zindagi Ke Rang,1982,Comedy|Documentary
2065,Dil Andaz Ke Rang,1952,Comedy|Drama|Romance
2066,Hamari Andaz Ka Safar,2007,Film-Noir
2067,Baazigar Raat Ke Rang,1942,Drama|Romance|War
2075,Ek Rishta Ka Raaz,1968,Drama|War
2076,Baazigar Manzil Se Mulakaat,1993,Drama|Mystery
2077,Aashiq Raat Ka Intezaar,1978,Adventure|Children's
2078,Hamari Raat Ka Raaz,1993,Animation|Children's|Comedy|Musical
2079,Chalte Sapna Ka Safar,2004,Children's|Drama
2080,Khiladi Zindagi Hai,1969,Animation|Children's|Comedy|Musical|Romance
2081,Tum Raja Ka Raaz,1936,Animation|Children's|Comedy|Musical|Romance
2085,Khiladi Sapna Ki Duniya,2009,Animation|Children's
2086,Tum Sapna Ki Baatein,2023,Drama|Fantasy
2087,Dil Manzil Ka Intezaar,1944,Animation|Children's|Fantasy|Musical
2088,Aashiq Kahani Ka Safar,2020,Adventure|Comedy|Musical
2089,Raj Raja Ke Rang,2014,Animation|Children's
2090,Aashiq Andaz Ke Rang,1941,Animation|Children's
2091,Khiladi Raat Ka Intezaar,2023,Children's|Sci-Fi
2093,Prem Raat Ke Rang,1971,Adventure|Children's|Fantasy|Sci-Fi
2094,Raj Kahani Ki Baatein,2007,Action|Adventure|Sci-Fi
2095,Aashiq Kahani Ki Baatein,1939,Children's|Comedy
2096,Shree Raat Ki Kahani,2014,Animation|Children's|Musical
2097,Aashiq Andaz Ki Kahani,1983,Children's|Horror
2098,Tum Manzil Se Mulakaat,2001,Children's|Comedy
2099,Tum Kahani Ki Kahani,1965,Adventure|Animation|Children's|Musical
2100,Hamari Mission Ki Duniya,1944,Comedy|Fantasy|Romance
2102,Hamari Rishta Ki Kahani,1978,Animation|Children's|Comedy|Musical
2105,Prem Sapna Se Mulakaat,1999,Action|Adventure|Fantasy|Sci-Fi
2108,Jab Rishta Ki Duniya,1971,Comedy|Romance
2110,Hamari Kahani Ka Safar,2016,Comedy|Crime|Thriller
2112,Khiladi Zindagi Ki Duniya,1966,Crime|Drama
2113,Khiladi Mission Ke Rang,1991,Horror|Thriller
2115,Prem Raat Hai,1932,Action|Adventure
2116,Dil Raat Hai,1996,Adventure|Animation|Children's|Sci-Fi
2117,Khiladi Dosti Se Mulakaat,2006,Drama|Sci-Fi
2118,Hamari Andaz Ke Rang,2014,Horror|Thriller
2121,Chalte Pyaar Ka Intezaar,1969,Horror|Thriller
